categoryId,name,description
1001,WOMEN,"A Canadian athletic apparel retailer. Lululemon is a self-described yoga-inspired athletic apparel company for women. The company makes a variety of types of athletic wear, including performance shirts, shorts, and pants, as well as lifestyle apparel and yoga accessories. The company was originally based in Canada, but has expanded to selling its products internationally in both store fronts and via their online platform, lululemon.com."
1002,MEN,"A Canadian athletic apparel retailer. Lululemon is a self-described yoga-inspired athletic apparel company for men. The company makes a variety of types of athletic wear, including performance shirts, shorts, and pants, as well as lifestyle apparel and yoga accessories. The company was originally based in Canada, but has expanded to selling its products internationally in both store fronts and via their online platform, lululemon.com."
1003,YOGA,"A group of physical, mental, and spiritual practices or disciplines which originated in ancient India. There is a broad variety of yoga schools, practices, and goals in Hinduism, Buddhism, and Jainism. Among the most well-known types of yoga are Hatha yoga and R?ja yoga."
1004,RUN,A method of terrestrial locomotion allowing humans and other animals to move rapidly on foot. Running is a type of gait characterized by an aerial phase in which all feet are above the ground (though there are exceptions). 
1005,SWIM,"An individual or team sport that requires the use of ones arms and legs to move the body through water. The sport takes place in pools or open water (e.g., in a sea or lake). Competitive swimming is one of the most popular Olympic sports,[1] with varied distance events in butterfly, backstroke, breaststroke, freestyle, and individual medley. "
